波特率115200，连接密码为蓝牙设备名称后四位，如设备为achf201246199，密码为6199

TC35661

  Device - Device ID (followed by the endpoint for USB devices)
            (20) USB-SERIAL CH341A （蓝牙模块到mcu）
            (21) USB-SERIAL CH340（mcu到蓝牙模块）
  Phase  - Phase Type
            IN    Data in transfer           
  Data   - Hex dump of the data transferred
  Descr  - Description of the phase
  Cmd... - Position in the captured data


Device  Phase  Data                                                                                                    Description                       Cmd.Phase.Ofs(rep)
------  -----  ------------------------------------------------------------------------------------------------------  --------------------------------  ------------------
  20    IN     00                                                                                                      .                                        1.1.0        
  21    IN     00                                                                                                      .                                        2.1.0        
  20    IN     04 0e 04 04  00 00 00                                                                                   .......                                  3.1.0        
  21    IN     01 03 0c 00                                                                                             ....                                     4.1.0        
  21    IN     01 08 fc 09  00 a1 00 00  00 14 0c ff  00                                                               .............                            5.1.0        
  20    IN     04 0e 04 04  03 0c 00                                                                                   .......                                  6.1.0        
  21    IN     01 13 10 06  3f 1f 24 b8  64 dc                                                                         ....?.$.d.                               7.1.0        
  20    IN     04 ff 1b 08  00 a1 00 00  00 14 0c 00  0f 38 2e 30  30 2e 37 32  42 20 52 4f  4d 3d 35 30  31 00 04 0e  .............8.00.72B ROM=501...         8.1.0        
               04 04 13 10  00                                                                                         .....                                    8.1.32       
  20    IN     04 ff 05 08  00 93 00 ff                                                                                ........                                 9.1.0        
  21    IN     01 08 fc 03  00 93 ff                                                                                   .......                                 10.1.0        
  20    IN     04 ff 0a 08  00 a0 00 00  00 14 55 00  00                                                               ..........U..                           11.1.0        
  21    IN     01 08 fc 2f  00 a0 00 00  00 14 55 ff  10 25 00 38  f8 0c 00 05  32 87 f7 e1  fc 00 28 79  d0 13 28 1a  .../......U..%.8....2.....(y..(.        12.1.0        
               d0 08 4c 2f  25 61 68 6d  01 49 19 89  7d 00 29 6f  d1 02 1c                                            ..L/%ahm.I....)o...                     12.1.32       
  21    IN     01 08 fc fa  00 a0 00 00  00 14 56 ff  10 f0 00 72  05 00 ff b5  91 b0 00 20  01 23 0f 90  11 1c 05 93  ..........V....r....... .#......        13.1.0        
               1c 9a 00 23  0d 90 03 93  00 93 07 90  06 90 10 70  99 4a 2f 23  12 68 5b 01  d2 18 90 75  11 a8 05 c8  ...#...........p.J/#.h[....u....        13.1.32       
               00 27 00 26  00 25 90 42  02 d8 11 98  00 28 07 d1  11 98 1b 9a  10 80 01 20  15 b0 f0 bc  08 bc 18 47  .'.&.%.B.....(......... .......G        13.1.64       
               14 98 02 28  05 d1 48 78  09 78 00 02  08 43 06 1c  06 e0 14 98  10 28 0d d1  10 22 08 a8  f1 f7 e1 ff  ...(..Hx.x...C.......(..."......        13.1.96       
  21    IN     0f 21 07 20  0e 90 10 91  77 f0 88 ff  ff 28 03 d1  0e 20 e1 e7  04 20 df e7  6e f0 cc fa  02 90 0f 99  .!. ....w....(... ... ..n.......        14.1.0        
               ca e0 0d 98  44 23 7c 49  58 43 40 18  0c 99 c9 00  44 58 40 18  04 90 b8 e0  14 98 a2 7c  10 28 08 d1  ....D#.IXC@.....DX@..........(..        14.1.32       
               10 2a 11 d1  a1 1c 08 a8  f1 f7 8f ff  00 06 00 0e  09 e0 14 98  02 28 07 d1  02 2a 05 d1  61 88 01 20  .*...................(...*..a..         14.1.64       
               b1 42 00 d1  00 20 05 90  05 98 00 28  71 d1 20 88  11 99 88 42  6d d3 12 99  88 42 6a d8  06 90        .B... .....(q. ....Bm....Bj...          14.1.96       
  20    IN     04 ff 0a 08  00 a0 00 00  00 14 56 00  00                                                               ..........V..                           15.1.0        
  21    IN     01 08 fc fa  00 a0 00 00  00 14 56 ff  10 f0 ec 72  05 00 e0 8a  07 99 02 30  00 06 00 0e  00 29 05 d1  ..........V....r.......0.....)..        16.1.0        
               62 49 2f 22  09 68 52 01  89 18 08 76  61 48 86 42  08 d0 01 30  86 42 05 d0  02 38 86 42  02 d0 01 38  bI/".hR....vaH.B...0.B...8.B...8        16.1.32       
               86 42 22 d1  14 98 02 28  1f d1 01 20  00 2f 00 90  04 d1 e0 8a  01 27 01 06  09 0e 03 91  e0 8a 03 99  .B"....(... ./.......'..........        16.1.64       
  21    IN     88 42 09 d1  51 48 01 68  2f 20 40 01  08 18 82 7d  02 32 40 2a  6c d8 4b e0  4c 48 2f 22  00 68 52 01  .B..QH.h/ @......2@*l.K.LH/".hR.        17.1.0        
               80 18 80 7d  00 28 63 d1  83 e0 02 99  20 1c 77 f0  c3 fe 01 90  77 f0 ae fe  01 99 23 29  06 d0 07 99  .....(c..... .w.....w.....#)....        17.1.32       
               00 29 7e d1  21 88 1b 9a  11 80 5f e7  6b 46 18 8b  21 88 00 09  00 01 08 1a  01 28 06 dd  a0 8a c0 07  .)..!....._.kF..!........(......        17.1.64       
               12 d1 07 98  00 28 6c d1  08 e0 04 98  00 68 80 69  00 78 80 07  08 d4 07 98  00 28 62 d1  20 88 1b 9a  .....(l......h.i.x.......(b. ...        17.1.96       
               10 80 02 20  42 e7 27 e0  00 2f 04 d1  e0 8a 01 27  01 06 09 0e  03 91 e0 8a  03 99 88 42  2a d1        ... B.'../.....'...........B*.          17.1.128      
  20    IN     04 ff 0a 08  00 a0 00 00  00 14 56 00  00                                                               ..........V..                           18.1.0        
  21    IN     01 08 fc c6  00 a0 00 00  00 14 56 ff  10 bc d8 73  05 00 2a 48  01 68 2f 20  40 01 08 18  82 7d 02 32  ..........V....s..*H.h/ @......2        19.1.0        
               40 2a 48 d8  49 19 0b 22  d2 01 89 18  6b 46 1a 7e  0b 1c 20 33  9a 75 6b 46  5a 7e 0b 1c  20 33 da 75  @*H.I.."....kF.... 3.ukFZ... 3.u        19.1.32       
  20    IN     04 ff 0a 08  00 a0 00 00  00 14 56 00  00                                                               ..........V..                           20.1.0        
  21    IN     81 7d 02 35  2d 06 2d 0e  02 31 81 75  01 20 05 90  e4 69 00 2c  00 d0 43 e7  0c 99 01 31  09 06 09 0e  ...5-.-..1.u. ...i.,..C....1....        21.1.0        
               0c 91 0a e0  29 e0 26 e0  15 48 2f 22  00 68 52 01  80 18 80 7d  00 28 1e d1  15 e0 0e 98  0c 99 81 42  ....).&..H/".hR......(.........B        21.1.32       
               00 d8 22 e7  0d 98 10 99  01 30 00 06  00 0e 88 42  0d 90 00 d8  17 e7 09 48  2f 22 00 68  52 01 80 18  .."......0.....B.......H/".hR...        21.1.64       
               80 7d 00 28  04 d1 11 98  1b 9a 10 80  0a 20 e7 e6  00 98 00 28  01 d1 00 20  e2 e6 13 20  e0 e6 bc 5c  ...(......... .....(... ... ...\        21.1.96       
               04 00 00 63  04 00 02 28  00 00                                                                         ...c...(..                              21.1.128      
  21    IN     01 08 fc 0b  00 a0 00 00  00 14 57 ff  02 00 01                                                         ..........W....                         22.1.0        
  20    IN     04 ff 0a 08  00 a0 00 00  00 14 57 00  00                                                               ..........W..                           23.1.0        
  20    IN     04 ff 0a 08  00 a0 00 00  00 14 55 00  00                                                               ..........U..                           24.1.0        
  21    IN     01 08 fc 2f  00 a0 00 00  00 14 55 ff  10 25 01 34  6e 0d 00 0f  20 06 90 f8  f7 a7 f9 ff  28 01 d1 0e  .../......U..%.4n... .......(...        25.1.0        
               20 e5 e7 ee  f7 ed fc 44  20 9d 4a 78  43 10 58 00  28 01 d1                                             ......D .JxC.X.(..                     25.1.32       
  20    IN     04 ff 0a 08  00 a0 00 00  00 14 57 00  00                                                               ..........W..                           26.1.0        
  21    IN     01 08 fc 0b  00 a0 00 00  00 14 57 ff  02 01 01                                                         ..........W....                         27.1.0        
  20    IN     04 ff 0a 08  00 a0 00 00  00 14 55 00  00                                                               ..........U..                           28.1.0        
  21    IN     01 08 fc 2f  00 a0 00 00  00 14 55 ff  10 25 02 94  71 0d 00 08  9a 10 2a 01  d3 0f 22 08  92 07 22 06  .../......U..%..q.....*..."...".        29.1.0        
               92 64 e0 07  9a 5a e0 0a  99 44 23 c9  4a 59 43 89  18 09 9a                                            .d...Z...D#.JYC....                     29.1.32       
  21    IN     01 08 fc 0b  00 a0 00 00  00 14 57 ff  02 02 01                                                         ..........W....                         30.1.0        
  20    IN     04 ff 0a 08  00 a0 00 00  00 14 57 00  00                                                               ..........W..                           31.1.0        
  20    IN     04 ff 05 08  00 99 00 01                                                                                ........                                32.1.0        
  21    IN     01 08 fc 03  00 99 01 17  00 00 e1 01  10 00 04 02  0d 41 43 48  46 32 30 31  32 34 36 31  39 39        .................ACHF201246199          33.1.0        
  20    IN     0e 00 00 e1  81 07 00 00  3f 1f 24 b8  64 dc                                                            ........?.$.d.                          34.1.0        
  21    IN     15 00 00 d1  01 0e 00 0d  41 43 48 46  32 30 31 32  34 36 31 39  39                                     ........ACHF201246199                   35.1.0        
  20    IN     0e 00 00 d1  81 07 00 00  3f 1f 24 b8  64 dc                                                            ........?.$.d.                          36.1.0        
  20    IN     08 00 00 d3  80 01 00 00                                                                                ........                                37.1.0        
  21    IN     07 00 00 d3  00 00 00                                                                                   .......                                 38.1.0        
  21    IN     07 00 00 d2  00 00 00                                                                                   .......                                 39.1.0        
  21    IN     12 00 00 e1  3d 0b 00 03  fc 08 00 d1  66 98 04 00  00 00                                               ....=.......f.....                      40.1.0        
  20    IN     08 00 00 d2  80 01 00 00                                                                                ........                                41.1.0        
  20    IN     0f 00 00 e1  bd 08 00 00  06 0f 04 00  01 03 fc 0e  00 00 e1 7d  07 00 ff 05  03 00 d1 00  00 0f 00 00  ................................        42.1.0        
               e1 bd 08 00  00 06 0f 04  00 01 03 fc  0e 00 00 e1  7d 07 00 ff  05 03 00 d1  00 00                     ..........................              42.1.32       
  21    IN     12 00 00 e1  3d 0b 00 03  fc 08 00 d1  54 98 04 00  00 00                                               ....=.......T.....                      43.1.0        
  21    IN     07 00 00 e5  01 00 00                                                                                   .......                                 44.1.0        
  21    IN     0a 00 00 d3  20 03 00 02  00 18                                                                         .... .....                              45.1.0        
  20    IN     08 00 00 e5  81 01 00 00  0a 00 00 d3  a0 03 00 00  01 00                                               ..................                      46.1.0        
  20    IN     0a 00 00 d3  a2 03 00 00  10 00                                                                         ..........                              47.1.0        
  21    IN     0d 00 00 d3  22 06 00 01  00 02 02 00  2a                                                               ....".......*                           48.1.0        
  20    IN     0a 00 00 d3  a3 03 00 00  11 00                                                                         ..........                              49.1.0        
  21    IN     1d 00 00 d3  23 16 00 10  00 02 00 2a  0d 00 41 43  48 46 32 30  31 32 34 36  31 39 39 03  07           ....#......*..ACHF201246199..           50.1.0        
  20    IN     0a 00 00 d3  a2 03 00 00  20 00                                                                         ........ .                              51.1.0        
  21    IN     0d 00 00 d3  22 06 00 01  00 02 02 01  2a                                                               ....".......*                           52.1.0        
  20    IN     0a 00 00 d3  a3 03 00 00  21 00                                                                         ........!.                              53.1.0        
  21    IN     12 00 00 d3  23 0b 00 20  00 02 01 2a  02 00 00 00  03 07                                               ....#.. ...*......                      54.1.0        
  21    IN     0d 00 00 d3  22 06 00 01  00 02 02 02  2a 11 00 00  d3 23 0a 00  30 00 02 02  2a 01 00 00  03 07        ....".......*....#..0...*.....          55.1.0        
  20    IN     0a 00 00 d3  a2 03 00 00  30 00 0a 00  00 d3 a3 03  00 00 31 00                                         ........0.........1.                    56.1.0        
  20    IN     0a 00 00 d3  a2 03 00 00  40 00                                                                         ........@.                              57.1.0        
  21    IN     0d 00 00 d3  22 06 00 01  00 02 02 03  2a                                                               ....".......*                           58.1.0        
  20    IN     0a 00 00 d3  a3 03 00 00  41 00                                                                         ........A.                              59.1.0        
  20    IN     0a 00 00 d3  a2 03 00 00  50 00                                                                         ........P.                              60.1.0        
  21    IN     16 00 00 d3  23 0f 00 40  00 02 03 2a  06 00 8f cf  03 07 02 04  03 07 0d 00  00 d3 22 06  00 01 00 02  ....#..@...*..............".....        61.1.0        
               02 04 2a                                                                                                ..*                                     61.1.32       
  21    IN     18 00 00 d3  23 11 00 50  00 02 04 2a  08 00 0a 00  03 07 00 00  00 00 03 07                            ....#..P...*............                62.1.0        
  20    IN     0a 00 00 d3  a3 03 00 00  51 00                                                                         ........Q.                              63.1.0        
  21    IN     0a 00 00 d3  20 03 00 02  0a 18 0d 00  00 d3 22 06  00 00 01 02  02 29 2a                               .... ........."......)*                 64.1.0        
  20    IN     0a 00 00 d3  a0 03 00 00  00 01 0a 00  00 d3 a2 03  00 00 10 01                                         ....................                    65.1.0        
  21    IN     15 00 00 d3  23 0e 00 10  01 02 29 2a  05 00 49 54  52 4f 4e 03  07                                     ....#.....)*..ITRON..                   66.1.0        
  20    IN     0a 00 00 d3  a3 03 00 00  11 01                                                                         ..........                              67.1.0        
  20    IN     0a 00 00 d3  a2 03 00 00  20 01                                                                         ........ .                              68.1.0        
  21    IN     0d 00 00 d3  22 06 00 00  01 02 02 24  2a                                                               ...."......$*                           69.1.0        
  21    IN     1b 00 00 d3  23 14 00 20  01 02 24 2a  0b 00 54 43  33 35 36 36  31 2d 35 30  31 03 07                  ....#.. ..$*..TC35661-501..             70.1.0        
  20    IN     0a 00 00 d3  a3 03 00 00  21 01                                                                         ........!.                              71.1.0        
  21    IN     0d 00 00 d3  22 06 00 00  01 02 02 25  2a                                                               ...."......%*                           72.1.0        
  20    IN     0a 00 00 d3  a2 03 00 00  30 01                                                                         ........0.                              73.1.0        
  20    IN     0a 00 00 d3  a3 03 00 00  31 01 0a 00  00 d3 a2 03  00 00 40 01                                         ........1.........@.                    74.1.0        
  21    IN     14 00 00 d3  23 0d 00 30  01 02 25 2a  04 00 30 30  30 30 03 07  0d 00 00 d3  22 06 00 00  01 02 02 27  ....#..0..%*..0000......"......'        75.1.0        
               2a                                                                                                      *                                       75.1.32       
  20    IN     0a 00 00 d3  a3 03 00 00  41 01                                                                         ........A.                              76.1.0        
  21    IN     18 00 00 d3  23 11 00 40  01 02 27 2a  08 00 35 30  35 30 5f 53  50 50 03 07                            ....#..@..'*..5050_SPP..                77.1.0        
  20    IN     0a 00 00 d3  a2 03 00 00  50 01                                                                         ........P.                              78.1.0        
  21    IN     0d 00 00 d3  22 06 00 00  01 02 02 26  2a                                                               ...."......&*                           79.1.0        
  20    IN     0a 00 00 d3  a3 03 00 00  51 01                                                                         ........Q.                              80.1.0        
  21    IN     1f 00 00 d3  23 18 00 50  01 02 26 2a  0f 00 38 2e  30 30 2e 37  32 42 20 52  4f 4d 3d 35  30 03 07     ....#..P..&*..8.00.72B ROM=50..         81.1.0        
  20    IN     0a 00 00 d3  a2 03 00 00  60 01                                                                         ........`.                              82.1.0        
  21    IN     0d 00 00 d3  22 06 00 00  01 02 02 28  2a                                                               ...."......(*                           83.1.0        
  21    IN     14 00 00 d3  23 0d 00 60  01 02 28 2a  04 00 30 30  30 30 03 07  0d 00 00 d3  22 06 00 00  01 02 02 23  ....#..`..(*..0000......"......#        84.1.0        
               2a                                                                                                      *                                       84.1.32       
  20    IN     0a 00 00 d3  a3 03 00 00  61 01 0a 00  00 d3 a2 03  00 00 70 01                                         ........a.........p.                    85.1.0        
  21    IN     21 00 00 d3  23 1a 00 70  01 02 23 2a  11 00 30 30  30 30 30 30  30 30 2d 30  30 30 30 30  30 30 30 03  !...#..p..#*..00000000-00000000.        86.1.0        
               07                                                                                                      .                                       86.1.32       
  20    IN     0a 00 00 d3  a3 03 00 00  71 01                                                                         ........q.                              87.1.0        
  20    IN     0a 00 00 d3  a0 03 00 00  00 02                                                                         ..........                              88.1.0        
  21    IN     18 00 00 d3  20 11 00 10  55 e4 05 d2  af 9f a9 8f  e5 4a 7d fe  43 53 53 49                            .... ...U........J..CSSI                89.1.0        
  21    IN     1b 00 00 d3  22 14 00 00  02 0a 10 fe  69 ca 9a 56  19 f6 ab 02  4d aa 6d 43  53 53 49                  ....".......i..V....M.mCSSI             90.1.0        
  20    IN     0a 00 00 d3  a2 03 00 00  10 02                                                                         ..........                              91.1.0        
  21    IN     27 00 00 d3  23 20 00 10  02 10 fe 69  ca 9a 56 19  f6 ab 02 4d  aa 6d 43 53  53 49 09 00  00 00 00 00  '...# .....i..V....M.mCSSI......        92.1.0        
               00 00 00 00  00 03 07                                                                                   .......                                 92.1.32       
  20    IN     0a 00 00 d3  a3 03 00 00  11 02                                                                         ..........                              93.1.0        
  21    IN     1b 00 00 d3  22 14 00 00  02 18 10 18  03 a6 28 5e  d8 ec 91 1c  48 a3 ac 43  53 53 49                  ....".........(^....H..CSSI             94.1.0        
  20    IN     0a 00 00 d3  a2 03 00 00  20 02                                                                         ........ .                              95.1.0        
  20    IN     0a 00 00 d3  a3 03 00 00  21 02                                                                         ........!.                              96.1.0        
  21    IN     1f 00 00 d3  23 18 00 20  02 10 18 03  a6 28 5e d8  ec 91 1c 48  a3 ac 43 53  53 49 01 00  01 03 07     ....#.. .....(^....H..CSSI.....         97.1.0        
  20    IN     0a 00 00 d3  a2 03 00 00  30 02                                                                         ........0.                              98.1.0        
  21    IN     1b 00 00 d3  22 14 00 00  02 10 10 16  96 24 47 c6  23 61 ba d9  4b 4d 1e 43  53 53 49                  ...."........$G.#a..KM.CSSI             99.1.0        
  21    IN     1f 00 00 d3  23 18 00 30  02 10 16 96  24 47 c6 23  61 ba d9 4b  4d 1e 43 53  53 49 01 00  01 03 07     ....#..0....$G.#a..KM.CSSI.....        100.1.0        
  20    IN     0a 00 00 d3  a3 03 00 00  31 02                                                                         ........1.                             101.1.0        
  21    IN     1b 00 00 d3  22 14 00 00  02 0c 10 b3  9b 72 34 be  ec d4 a8 f4  43 41 88 43  53 53 49 1f  00 00 d3 23  ...."........r4.....CA.CSSI....#       102.1.0        
               18 00 40 02  10 b3 9b 72  34 be ec d4  a8 f4 43 41  88 43 53 53  49 01 00 01  03 07                     ..@....r4.....CA.CSSI.....             102.1.32       
  20    IN     0a 00 00 d3  a2 03 00 00  40 02 0a 00  00 d3 a3 03  00 00 41 02                                         ........@.........A.                   103.1.0        
  20    IN     0a 00 00 d3  a2 03 00 00  50 02                                                                         ........P.                             104.1.0        
  21    IN     1b 00 00 d3  22 14 00 00  02 18 10 6e  e2 17 ef da  97 4c 95 9b  3a 6e 02 43  53 53 49                  ...."......n.....L..:n.CSSI            105.1.0        
  20    IN     0a 00 00 d3  a3 03 00 00  51 02                                                                         ........Q.                             106.1.0        
  21    IN     1f 00 00 d3  23 18 00 50  02 10 6e e2  17 ef da 97  4c 95 9b 3a  6e 02 43 53  53 49 01 00  01 03 07     ....#..P..n.....L..:n.CSSI.....        107.1.0        
  21    IN     0d 00 00 e1  3d 06 00 24  0c 03 04 04  24                                                               ....=..$....$                          108.1.0        
  20    IN     0f 00 00 e1  bd 08 00 00  06 0e 04 01  24 0c 00                                                         ............$..                        109.1.0        
  20    IN     0f 00 00 e1  bd 08 00 00  06 0f 04 00  01 03 fc 0e  00 00 e1 7d  07 00 ff 05  03 00 d1 00  00           .............................          110.1.0        
  21    IN     12 00 00 e1  3d 0b 00 03  fc 08 00 d1  50 98 04 00  01 01                                               ....=.......P.....                     111.1.0        
  21    IN     0e 00 00 e1  3d 07 00 1e  0c 04 00 02  12 00                                                            ....=.........                         112.1.0        
  20    IN     0f 00 00 e1  bd 08 00 00  06 0e 04 01  1e 0c 00                                                         ...............                        113.1.0        
  21    IN     0e 00 00 e1  3d 07 00 1c  0c 04 00 04  12 00                                                            ....=.........                         114.1.0        
  20    IN     0f 00 00 e1  bd 08 00 00  06 0e 04 01  1c 0c 00                                                         ...............                        115.1.0        
  21    IN     08 00 00 e1  0c 01 00 03  56 00 00 d1  08 4f 00 a0  00 00 01 00  00 00 00 00  00 00 00 00  07 00 12 02  ........V....O..................       116.1.0        
               01 02 0e 09  41 43 48 46                                                                                ....ACHF                               116.1.32       
  20    IN     08 00 00 e1  8c 01 00 00                                                                                ........                               117.1.0        
  21    IN     32 30 31 32  34 36 31 39  39 00 00 00  00 00 00 00  00 00 00 00  00 00 0f 0e  09 41 43 48  46 32 30 31  201246199................ACHF201       118.1.0        
               32 34 36 31  39 39 00 00  00 00 00 00  00 00 00 00  00 00 00 00  00 00                                  246199................                 118.1.32       
  20    IN     08 00 00 d1  88 01 00 00                                                                                ........                               119.1.0        
  20    IN     04 0e 04 04  00 00 00                                                                                   .......                                120.1.0        
  21    IN     01 03 0c 00                                                                                             ....                                   121.1.0        
  20    IN     04 0e 04 04  03 0c 00                                                                                   .......                                122.1.0        
  21    IN     01 08 fc 09  00 a1 00 00  00 14 0c ff  00                                                               .............                          123.1.0        
  20    IN     04 ff 1b 08  00 a1 00 00  00 14 0c 00  0f 38 2e 30  30 2e 37 32  42 20 52 4f  4d 3d 35 30  31 00        .............8.00.72B ROM=501.         124.1.0        
  21    IN     01 13 10 06  3f 1f 24 b8  64 dc 01 08  fc 03 00 93  ff                                                  ....?.$.d........                      125.1.0        
  21    IN     01 08 fc 2f  00 a0 00 00  00 14 55 ff  10 25 00 38  f8 0c 00 05  32 87 f7 e1  fc 00 28 79  d0 13 28 1a  .../......U..%.8....2.....(y..(.       126.1.0        
               d0 08 4c 2f  25 61 68 6d  01 49 19 89  7d 00 29 6f  d1 02 1c                                            ..L/%ahm.I....)o...                    126.1.32       
  20    IN     04 0e 04 04  13 10 00 04  ff 05 08 00  93 00 ff 04  ff 0a 08 00  a0 00 00 00  14 55 00 00               .........................U..           127.1.0        
  21    IN     01 08 fc fa  00 a0 00 00  00 14 56 ff  10 f0 00 72  05 00 ff b5  91 b0 00 20  01 23 0f 90  11 1c 05 93  ..........V....r....... .#......       128.1.0        
               1c 9a 00 23  0d 90 03 93  00 93 07 90  06 90 10 70  99 4a 2f 23  12 68 5b 01  d2 18 90 75  11 a8 05 c8  ...#...........p.J/#.h[....u....       128.1.32       
  21    IN     00 27 00 26  00 25 90 42  02 d8 11 98  00 28 07 d1  11 98 1b 9a  10 80 01 20  15 b0 f0 bc  08 bc 18 47  .'.&.%.B.....(......... .......G       129.1.0        
               14 98 02 28  05 d1 48 78  09 78 00 02  08 43 06 1c  06 e0 14 98  10 28 0d d1  10 22 08 a8  f1 f7 e1 ff  ...(..Hx.x...C.......(..."......       129.1.32       
               0f 21 07 20  0e 90 10 91  77 f0 88 ff  ff 28 03 d1  0e 20 e1 e7  04 20 df e7  6e f0 cc fa  02 90 0f 99  .!. ....w....(... ... ..n.......       129.1.64       
               ca e0 0d 98  44 23 7c 49  58 43 40 18  0c 99 c9 00  44 58 40 18  04 90 b8 e0  14 98 a2 7c  10 28 08 d1  ....D#.IXC@.....DX@..........(..       129.1.96       
               10 2a 11 d1  a1 1c 08 a8  f1 f7 8f ff  00 06 00 0e  09 e0 14 98  02 28 07 d1  02 2a 05 d1  61 88 01 20  .*...................(...*..a..        129.1.128      
  20    IN     04 ff 0a 08  00 a0 00 00  00 14 56 00  00                                                               ..........V..                          130.1.0        
  21    IN     b1 42 00 d1  00 20 05 90  05 98 00 28  71 d1 20 88  11 99 88 42  6d d3 12 99  88 42 6a d8  06 90 01 08  .B... .....(q. ....Bm....Bj.....       131.1.0        
               fc fa 00 a0  00 00 00 14  56 ff 10 f0  ec 72 05 00  e0 8a 07 99  02 30 00 06  00 0e 00 29  05 d1        ........V....r.......0.....)..         131.1.32       
  21    IN     62 49 2f 22  09 68 52 01  89 18 08 76  61 48 86 42  08 d0 01 30  86 42 05 d0  02 38 86 42  02 d0 01 38  bI/".hR....vaH.B...0.B...8.B...8       132.1.0        
               86 42 22 d1  14 98 02 28  1f d1 01 20  00 2f 00 90  04 d1 e0 8a  01 27 01 06  09 0e 03 91  e0 8a 03 99  .B"....(... ./.......'..........       132.1.32       
               88 42 09 d1  51 48 01 68  2f 20 40 01  08 18 82 7d  02 32 40 2a  6c d8 4b e0  4c 48 2f 22  00 68 52 01  .B..QH.h/ @......2@*l.K.LH/".hR.       132.1.64       
               80 18 80 7d  00 28 63 d1  83 e0 02 99  20 1c 77 f0  c3 fe 01 90  77 f0 ae fe  01 99 23 29  06 d0 07 99  .....(c..... .w.....w.....#)....       132.1.96       
               00 29 7e d1  21 88 1b 9a  11 80 5f e7  6b 46 18 8b  21 88 00 09  00 01 08 1a  01 28 06 dd  a0 8a c0 07  .)..!....._.kF..!........(......       132.1.128      
  21    IN     12 d1 07 98  00 28 6c d1  08 e0 04 98  00 68 80 69  00 78 80 07  08 d4 07 98  00 28 62 d1  20 88 1b 9a  .....(l......h.i.x.......(b. ...       133.1.0        
               10 80 02 20  42 e7 27 e0  00 2f 04 d1  e0 8a 01 27  01 06 09 0e  03 91 e0 8a  03 99 88 42  2a d1        ... B.'../.....'...........B*.         133.1.32       
  20    IN     04 ff 0a 08  00 a0 00 00  00 14 56 00  00                                                               ..........V..                          134.1.0        
  21    IN     01 08 fc c6  00 a0 00 00  00 14 56 ff  10 bc d8 73  05 00 2a 48  01 68 2f 20  40 01 08 18  82 7d 02 32  ..........V....s..*H.h/ @......2       135.1.0        
               40 2a 48 d8  49 19 0b 22  d2 01 89 18  6b 46 1a 7e  0b 1c 20 33  9a 75 6b 46  5a 7e 0b 1c  20 33 da 75  @*H.I.."....kF.... 3.ukFZ... 3.u       135.1.32       
               81 7d 02 35  2d 06 2d 0e  02 31 81 75  01 20 05 90  e4 69 00 2c  00 d0 43 e7  0c 99 01 31  09 06 09 0e  ...5-.-..1.u. ...i.,..C....1....       135.1.64       
               0c 91 0a e0  29 e0 26 e0  15 48 2f 22  00 68 52 01  80 18 80 7d  00 28 1e d1  15 e0 0e 98  0c 99 81 42  ....).&..H/".hR......(.........B       135.1.96       
               00 d8 22 e7  0d 98 10 99  01 30 00 06  00 0e 88 42  0d 90 00 d8  17 e7 09 48  2f 22 00 68  52 01 80 18  .."......0.....B.......H/".hR...       135.1.128      
  20    IN     04 ff 0a 08  00 a0 00 00  00 14 56 00  00 04 ff 0a  08 00 a0 00  00 00 14 57  00 00                     ..........V............W..             136.1.0        
  21    IN     80 7d 00 28  04 d1 11 98  1b 9a 10 80  0a 20 e7 e6  00 98 00 28  01 d1 00 20  e2 e6 13 20  e0 e6 bc 5c  ...(......... .....(... ... ...\       137.1.0        
               04 00 00 63  04 00 02 28  00 00 01 08  fc 0b 00 a0  00 00 00 14  57 ff 02 00  01                        ...c...(............W....              137.1.32       
  21    IN     01 08 fc 2f  00 a0 00 00  00 14 55 ff  10 25 01 34  6e 0d 00 0f  20 06 90 f8  f7 a7 f9 ff  28 01 d1 0e  .../......U..%.4n... .......(...       138.1.0        
               20 e5 e7 ee  f7 ed fc 44  20 9d 4a 78  43 10 58 00  28 01 d1                                             ......D .JxC.X.(..                    138.1.32       
  21    IN     01 08 fc 0b  00 a0 00 00  00 14 57 ff  02 01 01                                                         ..........W....                        139.1.0        
  20    IN     04 ff 0a 08  00 a0 00 00  00 14 55 00  00 04 ff 0a  08 00 a0 00  00 00 14 57  00 00                     ..........U............W..             140.1.0        
  21    IN     01 08 fc 2f  00 a0 00 00  00 14 55 ff  10 25 02 94  71 0d 00 08  9a 10 2a 01  d3 0f 22 08  92 07 22 06  .../......U..%..q.....*..."...".       141.1.0        
               92 64 e0 07  9a 5a e0 0a  99 44 23 c9  4a 59 43 89  18 09 9a                                            .d...Z...D#.JYC....                    141.1.32       
  20    IN     04 ff 0a 08  00 a0 00 00  00 14 55 00  00                                                               ..........U..                          142.1.0        
  20    IN     04 ff 0a 08  00 a0 00 00  00 14 57 00  00                                                               ..........W..                          143.1.0        
  21    IN     01 08 fc 0b  00 a0 00 00  00 14 57 ff  02 02 01                                                         ..........W....                        144.1.0        
  21    IN     01 08 fc 03  00 99 01                                                                                   .......                                145.1.0        
  20    IN     04 ff 05 08  00 99 00 01                                                                                ........                               146.1.0        
  21    IN     17 00 00 e1  01 10 00 04  02 0d 41 43  48 46 32 30  31 32 34 36  31 39 39                               ..........ACHF201246199                147.1.0        
  20    IN     0e 00 00 e1  81 07 00 00  3f 1f 24 b8  64 dc                                                            ........?.$.d.                         148.1.0        
  21    IN     15 00 00 d1  01 0e 00 0d  41 43 48 46  32 30 31 32  34 36 31 39  39                                     ........ACHF201246199                  149.1.0        
  21    IN     07 00 00 d3  00 00 00                                                                                   .......                                150.1.0        
  20    IN     0e 00 00 d1  81 07 00 00  3f 1f 24 b8  64 dc                                                            ........?.$.d.                         151.1.0        
  20    IN     08 00 00 d3  80 01 00 00                                                                                ........                               152.1.0        
  20    IN     08 00 00 d2  80 01 00 00                                                                                ........                               153.1.0        
  21    IN     07 00 00 d2  00 00 00                                                                                   .......                                154.1.0        
  21    IN     12 00 00 e1  3d 0b 00 03  fc 08 00 d1  66 98 04 00  00 00                                               ....=.......f.....                     155.1.0        
  20    IN     0f 00 00 e1  bd 08 00 00  06 0f 04 00  01 03 fc 0e  00 00 e1 7d  07 00 ff 05  03 00 d1 00  00           .............................          156.1.0(2)     
  21    IN     12 00 00 e1  3d 0b 00 03  fc 08 00 d1  54 98 04 00  00 00                                               ....=.......T.....                     158.1.0        
  21    IN     07 00 00 e5  01 00 00                                                                                   .......                                159.1.0        
  20    IN     08 00 00 e5  81 01 00 00                                                                                ........                               160.1.0        
  20    IN     0a 00 00 d3  a0 03 00 00  01 00                                                                         ..........                             161.1.0        
  21    IN     0a 00 00 d3  20 03 00 02  00 18                                                                         .... .....                             162.1.0        
  20    IN     0a 00 00 d3  a2 03 00 00  10 00                                                                         ..........                             163.1.0        
  20    IN     0a 00 00 d3  a3 03 00 00  11 00 0a 00  00 d3 a2 03  00 00 20 00                                         .................. .                   164.1.0        
  21    IN     0d 00 00 d3  22 06 00 01  00 02 02 00  2a 1d 00 00  d3 23 16 00  10 00 02 00  2a 0d 00 41  43 48 46 32  ....".......*....#......*..ACHF2       165.1.0        
               30 31 32 34  36 31 39 39  03 07 0d 00  00 d3 22 06  00 01 00 02  02 01 2a                               01246199......".......*                165.1.32       
  20    IN     0a 00 00 d3  a3 03 00 00  21 00                                                                         ........!.                             166.1.0        
  21    IN     12 00 00 d3  23 0b 00 20  00 02 01 2a  02 00 00 00  03 07                                               ....#.. ...*......                     167.1.0        
  20    IN     0a 00 00 d3  a2 03 00 00  30 00                                                                         ........0.                             168.1.0        
  21    IN     0d 00 00 d3  22 06 00 01  00 02 02 02  2a                                                               ....".......*                          169.1.0        
  20    IN     0a 00 00 d3  a3 03 00 00  31 00                                                                         ........1.                             170.1.0        
  21    IN     11 00 00 d3  23 0a 00 30  00 02 02 2a  01 00 00 03  07                                                  ....#..0...*.....                      171.1.0        
  20    IN     0a 00 00 d3  a2 03 00 00  40 00 0a 00  00 d3 a3 03  00 00 41 00                                         ........@.........A.                   172.1.0        
  21    IN     0d 00 00 d3  22 06 00 01  00 02 02 03  2a 16 00 00  d3 23 0f 00  40 00 02 03  2a 06 00 8f  cf 03 07 02  ....".......*....#..@...*.......       173.1.0        
               04 03 07                                                                                                ...                                    173.1.32       
  21    IN     0d 00 00 d3  22 06 00 01  00 02 02 04  2a                                                               ....".......*                          174.1.0        
  20    IN     0a 00 00 d3  a2 03 00 00  50 00                                                                         ........P.                             175.1.0        
  21    IN     18 00 00 d3  23 11 00 50  00 02 04 2a  08 00 0a 00  03 07 00 00  00 00 03 07                            ....#..P...*............               176.1.0        
  20    IN     0a 00 00 d3  a3 03 00 00  51 00                                                                         ........Q.                             177.1.0        
  21    IN     0a 00 00 d3  20 03 00 02  0a 18                                                                         .... .....                             178.1.0        
  20    IN     0a 00 00 d3  a0 03 00 00  00 01                                                                         ..........                             179.1.0        
  21    IN     0d 00 00 d3  22 06 00 00  01 02 02 29  2a                                                               ...."......)*                          180.1.0        
  20    IN     0a 00 00 d3  a2 03 00 00  10 01                                                                         ..........                             181.1.0        
  20    IN     0a 00 00 d3  a3 03 00 00  11 01 0a 00  00 d3 a2 03  00 00 20 01                                         .................. .                   182.1.0        
  21    IN     15 00 00 d3  23 0e 00 10  01 02 29 2a  05 00 49 54  52 4f 4e 03  07 0d 00 00  d3 22 06 00  00 01 02 02  ....#.....)*..ITRON......"......       183.1.0        
               24 2a                                                                                                   $*                                     183.1.32       
  21    IN     1b 00 00 d3  23 14 00 20  01 02 24 2a  0b 00 54 43  33 35 36 36  31 2d 35 30  31 03 07                  ....#.. ..$*..TC35661-501..            184.1.0        
  20    IN     0a 00 00 d3  a3 03 00 00  21 01                                                                         ........!.                             185.1.0        
  20    IN     0a 00 00 d3  a2 03 00 00  30 01                                                                         ........0.                             186.1.0        
  21    IN     0d 00 00 d3  22 06 00 00  01 02 02 25  2a                                                               ...."......%*                          187.1.0        
  20    IN     0a 00 00 d3  a3 03 00 00  31 01                                                                         ........1.                             188.1.0        
  21    IN     14 00 00 d3  23 0d 00 30  01 02 25 2a  04 00 30 30  30 30 03 07                                         ....#..0..%*..0000..                   189.1.0        
  21    IN     0d 00 00 d3  22 06 00 00  01 02 02 27  2a                                                               ...."......'*                          190.1.0        
  20    IN     0a 00 00 d3  a2 03 00 00  40 01                                                                         ........@.                             191.1.0        
  21    IN     18 00 00 d3  23 11 00 40  01 02 27 2a  08 00 35 30  35 30 5f 53  50 50 03 07  0d 00 00 d3  22 06 00 00  ....#..@..'*..5050_SPP......"...       192.1.0        
               01 02 02 26  2a                                                                                         ...&*                                  192.1.32       
  20    IN     0a 00 00 d3  a3 03 00 00  41 01 0a 00  00 d3 a2 03  00 00 50 01                                         ........A.........P.                   193.1.0        
  21    IN     1f 00 00 d3  23 18 00 50  01 02 26 2a  0f 00 38 2e  30 30 2e 37  32 42 20 52  4f 4d 3d 35  30 03 07     ....#..P..&*..8.00.72B ROM=50..        194.1.0        
  20    IN     0a 00 00 d3  a3 03 00 00  51 01                                                                         ........Q.                             195.1.0        
  21    IN     0d 00 00 d3  22 06 00 00  01 02 02 28  2a                                                               ...."......(*                          196.1.0        
  20    IN     0a 00 00 d3  a2 03 00 00  60 01                                                                         ........`.                             197.1.0        
  21    IN     14 00 00 d3  23 0d 00 60  01 02 28 2a  04 00 30 30  30 30 03 07                                         ....#..`..(*..0000..                   198.1.0        
  20    IN     0a 00 00 d3  a3 03 00 00  61 01                                                                         ........a.                             199.1.0        
  20    IN     0a 00 00 d3  a2 03 00 00  70 01                                                                         ........p.                             200.1.0        
  21    IN     0d 00 00 d3  22 06 00 00  01 02 02 23  2a                                                               ...."......#*                          201.1.0        
  20    IN     0a 00 00 d3  a3 03 00 00  71 01                                                                         ........q.                             202.1.0        
  21    IN     21 00 00 d3  23 1a 00 70  01 02 23 2a  11 00 30 30  30 30 30 30  30 30 2d 30  30 30 30 30  30 30 30 03  !...#..p..#*..00000000-00000000.       203.1.0        
               07                                                                                                      .                                      203.1.32       
  21    IN     18 00 00 d3  20 11 00 10  55 e4 05 d2  af 9f a9 8f  e5 4a 7d fe  43 53 53 49  1b 00 00 d3  22 14 00 00  .... ...U........J..CSSI...."...       204.1.0        
               02 0a 10 fe  69 ca 9a 56  19 f6 ab 02  4d aa 6d 43  53 53 49                                            ....i..V....M.mCSSI                    204.1.32       
  20    IN     0a 00 00 d3  a0 03 00 00  00 02 0a 00  00 d3 a2 03  00 00 10 02                                         ....................                   205.1.0        
  20    IN     0a 00 00 d3  a3 03 00 00  11 02                                                                         ..........                             206.1.0        
  21    IN     27 00 00 d3  23 20 00 10  02 10 fe 69  ca 9a 56 19  f6 ab 02 4d  aa 6d 43 53  53 49 09 00  00 00 00 00  '...# .....i..V....M.mCSSI......       207.1.0        
               00 00 00 00  00 03 07                                                                                   .......                                207.1.32       
  20    IN     0a 00 00 d3  a2 03 00 00  20 02                                                                         ........ .                             208.1.0        
  21    IN     1b 00 00 d3  22 14 00 00  02 18 10 18  03 a6 28 5e  d8 ec 91 1c  48 a3 ac 43  53 53 49                  ....".........(^....H..CSSI            209.1.0        
  21    IN     1f 00 00 d3  23 18 00 20  02 10 18 03  a6 28 5e d8  ec 91 1c 48  a3 ac 43 53  53 49 01 00  01 03 07     ....#.. .....(^....H..CSSI.....        210.1.0        
  20    IN     0a 00 00 d3  a3 03 00 00  21 02                                                                         ........!.                             211.1.0        
  20    IN     0a 00 00 d3  a2 03 00 00  30 02                                                                         ........0.                             212.1.0        
  21    IN     1b 00 00 d3  22 14 00 00  02 10 10 16  96 24 47 c6  23 61 ba d9  4b 4d 1e 43  53 53 49                  ...."........$G.#a..KM.CSSI            213.1.0        
  21    IN     1f 00 00 d3  23 18 00 30  02 10 16 96  24 47 c6 23  61 ba d9 4b  4d 1e 43 53  53 49 01 00  01 03 07     ....#..0....$G.#a..KM.CSSI.....        214.1.0        
  20    IN     0a 00 00 d3  a3 03 00 00  31 02                                                                         ........1.                             215.1.0        
  21    IN     1b 00 00 d3  22 14 00 00  02 0c 10 b3  9b 72 34 be  ec d4 a8 f4  43 41 88 43  53 53 49                  ...."........r4.....CA.CSSI            216.1.0        
  20    IN     0a 00 00 d3  a2 03 00 00  40 02                                                                         ........@.                             217.1.0        
  20    IN     0a 00 00 d3  a3 03 00 00  41 02                                                                         ........A.                             218.1.0        
  21    IN     1f 00 00 d3  23 18 00 40  02 10 b3 9b  72 34 be ec  d4 a8 f4 43  41 88 43 53  53 49 01 00  01 03 07     ....#..@....r4.....CA.CSSI.....        219.1.0        
  21    IN     1b 00 00 d3  22 14 00 00  02 18 10 6e  e2 17 ef da  97 4c 95 9b  3a 6e 02 43  53 53 49                  ...."......n.....L..:n.CSSI            220.1.0        
  20    IN     0a 00 00 d3  a2 03 00 00  50 02                                                                         ........P.                             221.1.0        
  21    IN     1f 00 00 d3  23 18 00 50  02 10 6e e2  17 ef da 97  4c 95 9b 3a  6e 02 43 53  53 49 01 00  01 03 07 0d  ....#..P..n.....L..:n.CSSI......       222.1.0        
               00 00 e1 3d  06 00 24 0c  03 04 04 24                                                                   ...=..$....$                           222.1.32       
  20    IN     0a 00 00 d3  a3 03 00 00  51 02 0f 00  00 e1 bd 08  00 00 06 0e  04 01 24 0c  00                        ........Q.............$..              223.1.0        
  20    IN     0f 00 00 e1  bd 08 00 00  06 0f 04 00  01 03 fc 0e  00 00 e1 7d  07 00 ff 05  03 00 d1 00  00           .............................          224.1.0        
  21    IN     12 00 00 e1  3d 0b 00 03  fc 08 00 d1  50 98 04 00  01 01                                               ....=.......P.....                     225.1.0        
  20    IN     0f 00 00 e1  bd 08 00 00  06 0e 04 01  1e 0c 00 0f  00 00 e1 bd  08 00 00 06  0e 04 01 1c  0c 00        ..............................         226.1.0        
  21    IN     0e 00 00 e1  3d 07 00 1e  0c 04 00 02  12 00 0e 00  00 e1 3d 07  00 1c 0c 04  00 04 12 00               ....=.............=.........           227.1.0        
  21    IN     08 00 00 e1  0c 01 00 03                                                                                ........                               228.1.0        
  20    IN     08 00 00 e1  8c 01 00 00                                                                                ........                               229.1.0        
  20    IN     08 00 00 d1  88 01 00 00                                                                                ........                               230.1.0        
  21    IN     56 00 00 d1  08 4f 00 a0  00 00 01 00  00 00 00 00  00 00 00 00  07 00 12 02  01 02 0e 09  41 43 48 46  V....O......................ACHF       231.1.0        
               32 30 31 32  34 36 31 39  39 00 00 00  00 00 00 00  00 00 00 00  00 00 0f 0e  09 41 43 48  46 32 30 31  201246199................ACHF201       231.1.32       
               32 34 36 31  39 39 00 00  00 00 00 00  00 00 00 00  00 00 00 00  00 00                                  246199................                 231.1.64       
